{
  "schemaVersion": 1,
  "version": "0.1.1",
  "generatedAt": "2026-10-19T07:04:35.567Z",
  "commit": "5e0c43a2185ff3695ce02394c9d66d998f692e3f",
  "node": "v24.22.0",
  "packages": {
    "workspace": 13,
    "npm": 14,
    "names": [
      "@ramonyx/adapter-runtime",
      "@ramonyx/bundler",
      "@ramonyx/compiler",
      "@ramonyx/core",
      "@ramonyx/devtools",
      "ramonyx",
      "@ramonyx/react",
      "@ramonyx/router",
      "@ramonyx/schema",
      "@ramonyx/security",
      "@ramonyx/server",
      "@ramonyx/ssr",
      "@ramonyx/testing",
      "create-ramonyx-app"
    ]
  },
  "adrs": 69,
  "tests": {
    "node": 233,
    "rust": 111,
    "e2eSpecFiles": 7
  }
}
